playmusic	play yuauea by rick ross
playmusic	play me a song by kevin cadogan
playmusic	play pandora tunes from the fourties
playmusic	play some drum & bass
playmusic	play the música da série de filmes o hobbit album by alex otaola
playmusic	play some chanson music
playmusic	play acid punk music
playmusic	play fight on  state
playmusic	play some seventies dj colette
playmusic	play me a 1974 tune on slacker
addtoplaylist	add bright and breezy to my this is gucci mane playlist
addtoplaylist	add track to all out 70s
addtoplaylist	add how to sos 48 2016 playlist
addtoplaylist	add this song by torch to my sing along playlist
addtoplaylist	add some patrick stump to maritza s disco fever list
addtoplaylist	i want another artist on my atmospheric black metal playlist
addtoplaylist	put paula abdul on musica española 2017
addtoplaylist	add bulat schalwowitsch okudschawa to retro pop
addtoplaylist	can you add esquivando charcos to my playlist entitled the piano bar
addtoplaylist	add something so right to lora s 80s classic hits playlist
ratebook	the current book i m reading should be rated zero out of 6
ratebook	rate a thousand lies series a 3
ratebook	rate the stone key a 5
ratebook	rate in search of our origins two points out of 6
ratebook	i want to give rebbe: the life and teachings of menachem m  schneerson  the most influential rabbi in modern history two out of 6 points
ratebook	rate this album a 1
ratebook	rate the current novel one points
ratebook	give after having spent a night among horses 0 out of 6
ratebook	rate the nightmare fair five out of 6 stars
ratebook	rate the current novel 5 of 6 points
searchscreeningevent	what films are there being played at megaplex theatres
searchscreeningevent	what time is murph the surf playing
searchscreeningevent	she me that movie schedule
searchscreeningevent	what are the current movie schedules for amc theatres
searchscreeningevent	is the mystical adventures of billy owens playing at the closest movie house
searchscreeningevent	what time is dark world showing at consolidated theatres
searchscreeningevent	find a movie theatre with rogues and romance that is nearest
searchscreeningevent	find the closest movie house that plays animated movies
searchscreeningevent	what s the closest movie theatre showing harbour beat
searchscreeningevent	list movies at imax corporation
bookrestaurant	book a spot for seven at a japanese joint in grandview heights
bookrestaurant	make a reservation for 9 at a brasserie with parking
bookrestaurant	book a reservation for the training table on mar  thirteenth  2026
bookrestaurant	book me a restaurant ten minutes from now
bookrestaurant	i need a party of two reservation faraway from atlantic av-barclays ctr at a spa for fast food
bookrestaurant	get me a table for 3 within walking distance from my hotel in tajikistan
bookrestaurant	lets eat at newport creamery in carnot
bookrestaurant	i would like to book a tea house at 08:05
bookrestaurant	book a table for four in orchard grass hills  nv
bookrestaurant	book a tavern in colorado for two
getweather	what is the weather forecast for sep  the 14th  2038 in north dakota
getweather	will there be a blizzard in kettleman city today
getweather	weather for burr
getweather	tell me the weather forecast for apr  twenty-fourth  2028 in san diego
getweather	what will the weather be like in louisiana will it be colder then now
getweather	will the weather be temperate 22 minutes from now in alba
getweather	what will the weather be in the current place 1 minute from now
getweather	will there be a blizzard at a 4 am  in sky valley
getweather	is it chilly in henrieville  oman
getweather	what is the weather forecast for papua new guinea
searchcreativework	find time squared
searchcreativework	i d like to see the show migration
searchcreativework	find fragile frontiers: the secret history of mumbai terror attacks
searchcreativework	find the cartel vol  2 novel
searchcreativework	what is the read all about it picture
searchcreativework	find the show the demi-gods and semi-devils
searchcreativework	show me the trailer a self made hero
searchcreativework	can you find me the game  super scription of data
searchcreativework	i d like to see apartment hunting
searchcreativework	i want to world of warcraft: tides of darkness
